{
  "event_type": "PROOF_VERIFIED",
  "payload_hash": "sha256:cbfe6580f009cb6033b57f598302d3cb60a0966ffe57e0a4fffe9e85d4da5a22",
  "previous_event_hash": "sha256:f3be67a1a3a0e4a305194738c2768753d2fd62a179b46928777c086dab52612a",
  "target": "claim:obligation-implies-permission:v1",
  "actor": "github:cr4bbz",
  "timestamp": "2026-06-29T12:55:13Z",
  "metadata": {
    "verification_commit": "58db818d3a0a0d1dc6b33418923aee517c05189e"
  },
  "schema_version": "0.1.0",
  "event_hash": "sha256:64871003dda07c78f577d63534c3ffa88a0f3a1882d7da6ec6038f946ea03bd9",
  "signature": {
    "algorithm": "ed25519",
    "key_id": "theorem-dna-genesis-2026",
    "public_key": "keys\\ledger-signing.pub.pem",
    "public_key_hash": "sha256:062c5a01518e03de0d4cc0b7a6478d70dd2775eeef1a06e6f69889396a6dfa21",
    "signed_hash": "sha256:64871003dda07c78f577d63534c3ffa88a0f3a1882d7da6ec6038f946ea03bd9",
    "value": "RYxiv9GZHo7WK92khoRCClbJG/N9esPKEfGP2FKBXe62xvBJsa3hiPF5ZAz2tWBgPSN4yLP0cq2vjYFXxYbMDg=="
  }
}
